{
  "schemaVersion": "2",
  "id": "files",
  "version": "0.2.0",
  "requires": [
    "auth",
    "rbac"
  ],
  "conflicts": [],
  "responsibilities": [
    "upload",
    "metadata",
    "download-url",
    "delete",
    "quarantine",
    "reconciliation",
    "quota"
  ],
  "contracts": [
    {
      "id": "files-api",
      "version": "1.0.0",
      "kind": "api"
    },
    {
      "id": "files-metadata",
      "version": "1.0.0",
      "kind": "schema"
    }
  ],
  "primitives": [
    {
      "id": "files-metadata-store",
      "kind": "relational-database",
      "requirement": "required",
      "purposes": [
        "metadata",
        "quota",
        "reconciliation"
      ]
    },
    {
      "id": "files-object-store",
      "kind": "object-storage",
      "requirement": "required",
      "purposes": [
        "binary-content"
      ]
    }
  ],
  "configuration": {},
  "targets": {
    "nestjs": {
      "status": "ready",
      "mode": "overlay",
      "adapter": {
        "id": "nestjs",
        "version": "1.0.0"
      },
      "responsibilities": [
        "upload",
        "metadata",
        "download-url",
        "delete",
        "quarantine",
        "reconciliation",
        "quota"
      ],
      "contracts": [
        "files-api",
        "files-metadata"
      ],
      "primitives": [
        "files-metadata-store",
        "files-object-store"
      ],
      "deploymentModes": [
        "embedded"
      ],
      "migrations": [
        "files-nestjs-database"
      ],
      "conformance": [
        "files-nestjs-contract"
      ]
    },
    "spring": {
      "status": "ready",
      "mode": "overlay",
      "adapter": {
        "id": "spring",
        "version": "1.0.0"
      },
      "responsibilities": [
        "upload",
        "metadata",
        "download-url",
        "delete",
        "quarantine"
      ],
      "contracts": [
        "files-api",
        "files-metadata"
      ],
      "primitives": [
        "files-metadata-store",
        "files-object-store"
      ],
      "deploymentModes": [
        "embedded"
      ],
      "migrations": [
        "files-spring-database"
      ],
      "conformance": [
        "files-spring-integration"
      ]
    },
    "fastapi": {
      "status": "unsupported"
    },
    "nextjs": {
      "status": "ready",
      "mode": "overlay",
      "adapter": {
        "id": "nextjs",
        "version": "1.0.0"
      },
      "responsibilities": [
        "upload",
        "metadata",
        "download-url",
        "delete",
        "quarantine"
      ],
      "contracts": [
        "files-api",
        "files-metadata"
      ],
      "primitives": [],
      "deploymentModes": [
        "embedded"
      ],
      "migrations": [],
      "conformance": [
        "files-nextjs-e2e"
      ]
    },
    "angular": {
      "status": "planned"
    },
    "react-native": {
      "status": "ready",
      "mode": "overlay",
      "adapter": {
        "id": "react-native",
        "version": "1.0.0"
      },
      "responsibilities": [
        "upload"
      ],
      "contracts": [
        "files-api",
        "files-metadata"
      ],
      "primitives": [],
      "deploymentModes": [
        "embedded"
      ],
      "migrations": [],
      "conformance": [
        "files-react-native-integration"
      ]
    },
    "flutter": {
      "status": "planned"
    }
  },
  "migrations": [
    {
      "id": "files-nestjs-database",
      "target": "nestjs",
      "kind": "database",
      "strategy": "additive",
      "path": "targets/nestjs/files/prisma/migrations/20260719000300_files_init/migration.sql",
      "order": 300
    },
    {
      "id": "files-spring-database",
      "target": "spring",
      "kind": "database",
      "strategy": "additive",
      "path": "targets/spring/files/src/main/resources/db/migration/V3__add_stored_files.sql",
      "order": 300
    }
  ],
  "conformance": [
    {
      "id": "files-nestjs-contract",
      "target": "nestjs",
      "level": "contract",
      "evidence": "overlay-verification"
    },
    {
      "id": "files-spring-integration",
      "target": "spring",
      "level": "integration",
      "evidence": "overlay-verification"
    },
    {
      "id": "files-nextjs-e2e",
      "target": "nextjs",
      "level": "e2e",
      "evidence": "overlay-verification"
    },
    {
      "id": "files-react-native-integration",
      "target": "react-native",
      "level": "integration",
      "evidence": "overlay-verification"
    }
  ]
}
